ID	Name	DC	Item	Value	Weight	Crafting	Requires	ValueNumber	WeightNumber	Multiplier	Misc	Description
gorgon	Gorgon	20	Gorgon Horn	20 gp	20 lb.	Lance, +1 (DMG) Trident, +1 (DMG) War pick, +1 (DMG) Javelin, +1 (DMG) or Spear, +1 (DMG)		20	20	2	 (x2)	It is hard to decide whether it is preferable to die by the hooves or the horn of a gorgon. Either way, a successfully harvested gorgon horn can be refined by any skilled blacksmith into a formidable weapon.
gorgon	Gorgon	20	Gorgon Plate	30 gp	60 lb.	Any heavy armour or shield, + 1 (DMG)		30	60	1		The iron-like armour plating of a gorgon is incredibly hard and yet is supple and breathes like skin. It is thus a unique and useful material for making fine armours.
grell	Grell	10	Grell Tentacle	3 gp	5 lb.	Whip, +1 (DMG)		3	5	2	 (x2)	The formidable tentacles of a grell make fine whips once they are removed, dried, treated and fitted with a handle. Many Underdark societies have been seen using whips made from grells, for both their strength and their intimidation factor.
grell	Grell	15	Grell Poison	30 gp	1 lb.		vial	30	1	1	 (vial)	A grell's poison is known to paralyse hapless victims, leaving them helpless as the grell flies away with them to be devoured. By removing the gland located where its tentacles meet its body, this poison can be extracted and used against one's own enemies. Use: Can be used to coat up to 5 pieces of slashing or piercing ammunition or one slashing or piercing weapon. Applying the poison takes 1 minute. For the next minute, any creature successfully hit must succed on a DC 15 Constitution saving throw or be poisoned. The poisoned target is paralyzed, and it can repeat the saving throw at the end of each of its turns, ending the effect on a success.
grell	Grell	20	Grell Hide	40 gp	8 lb.	Grell Jerkin		40	8	1		The hide of a grell is extremely sensitve to certain stimuli that completely bypasses the sense of most humanoids. Extremely difficult to remove intact, this hide can be used to craft armours that grant its wearer a sixth-sense similar to the grell's own.
grick	Grick	10	Grick Tentacle	1 gp	6 lb.			1	6	4	 (x4)	The deadly tentacle of a grick is both rubbery and sharp. However, after prolonged tenderising, boiling, and seasoning, these tentacles make for a delicacy that several Underdark races have come to enjoy. It is usually served with a sauce reduced from the grick's own blood. It is an acquired taste to say the least.
grick	Grick	15	Grick Hide	10 gp	18 lb.	Grick Hide Cloak		10	18	1		The skin of a grick has a unique shade and hue that allows it to blend into its rocky surroundings with ease. While difficult to remove properly from its rubbery carcass, the resulting hide makes for good camouflage clothes.
alpha-grick	Alpha Grick	10	Alpha Grick Tentacle	1 gp	10 lb.			1	10	4	 (x4)	The deadly tentacle of a grick is both rubbery and sharp. However, after prolonged tenderising, boiling, and seasoning, these tentacles make for a delicacy that several Underdark races have come to enjoy. It is usually served with a sauce reduced from the grick's own blood. It is an acquired taste to say the least.
alpha-grick	Alpha Grick	15	Alpha Grick Hide	25 gp	22 lb.	Grick Hide Cloak		25	22	1		The skin of a grick has a unique shade and hue that allows it to blend into its rocky surroundings with ease. While difficult to remove properly from its rubbery carcass, the resulting hide makes for good camouflage clothes.
alpha-grick	Alpha Grick	20	Grick Pearl	185 gp	5 lb.	Gem of the Underdark		185	5	1		The grick that has become large enough to lead other gricks as an alpha is usually the one that has lived long enough to eat the most stuff. Because of the grick's voracious apetite and low intelligence, sometimes this stuff includes the treasures of the hapless victims that cross its path. In rare circumstances, these treasures can sit in the grick's digestive system for a prolonged time and form a pearl. This pearl resembles whatever mish mash of materials created it, but coated with what appears to be a supernaturally dark hue that never goes away despite the lighting. This pearl can be taken by artificers and crafted into an item that taps into its inherent connection to the Underdark.
griffon	Griffon	5	Griffon Talon	5 sp	20 lb.			0.5	20	2	 (x2)	The talons of a griffon contain a unique collagen in them that when rendered creates a high quality adhesive. This glue is prized by leatherworkers and most can never find enough to meet their demand.
griffon	Griffon	10	Griffon Feather	1 gp	1 lb.	Arrow +1 (DMG)		1	1	10	 (x10)	The pristine feathers of a griffon carry an almost supernatural aerodynamic quality to them. Fletchers and sharpshooters prize good condition griffon feathers for crafting high quality arrows.
griffon	Griffon	15	Griffon Eye	5 gp	1 lb.	Eye of the Eagle (DMG)		5	1	2	 (x2)	A griffon can spot prey while flying miles overhead, and spot potential rivals from great distances. Their magical eyes have long been used as as charms and medicines by mountainfolk, but the utilisation of their eyes has been perfected by artificers capable of turning them into an eyes of the eagle mask.
grimlock	Grimlock	20	Grimlock Brain	5 gp	4 lb.	Potion of Mind Flayer Resistance		5	4	1		Grimlocks are a pathetic race, descendent from humans craven enough to worship the illithid race as deities. That said, their wretchedness can still prove useful to the rest of us. Generations of exposure to the illithid's experiments and influence has produced a permanent physiological change in the brain of the grimlock that when brewed into a potion, can provide some level of immunity to the abilities of the mind flayers. 
green-hag	Green Hag	10	Green Hag Hair (small pouch)	1 gp	4 lb.			1	4	1		The hair of a green hag flows like rotten reeds at the bottom of a swamp. While unpleasant to both observe and to hold, it possesses some weak magical properties and is often used by seedier alchemists looking for cheap substitutes for higher quality ingredients.
green-hag	Green Hag	10	Hag Blood	3 gp	1 lb.		vial	3	1	3	 (3 vials)	Absolutely reeking of the foulness that permeated the hag's entire being, drinking this blood has the potential to infect a creature with crone's disease. It should also be noted that while the blood smells and tastes as fetid as it looks, alcohol has a neutralising effect on both of these properties. What someone does with that information is entirely out of this writer's control.
green-hag	Green Hag	15	Green Hag Skull	14 gp	10 lb.	Deception Skull		14	10	1		Green hags are notorious for their ability to mimic sounds to lure or scare intruders to their lairs. This ability lingers behind in their skulls and artificers can draw out this latent power to create a magical trinket with much of the same property. In several ways, the hag would probably have enjoyed the idea of its carcass being used for such a macabre activity. 
green-hag	Green Hag	20	Hag Eyeball	50 gp	1 lb.			50	1	1		"Not to be confused with the notorious ""hag eye"" amulet given by hags to their servants, however the two are tightly linked. Despite being severed from its socket, this eye still seems to glare as it did in life. Use: As an action you may concentrate on the hag eyeball while it is in your hand. While doing so, you may utilise that hag's hag eye that same way they would have used it in life. If the hag eye is destroyed while you are concentrating on the hag eyeball, you suffer 3d10 psychic damage and are blinded for 24 hours."
night-hag	Night Hag	10	Night Hag Hair (small pouch)	3 gp	4 lb.	Night Hag Dreamcatcher		3	4	1		As thick and dark as a suffocating night, night hag hair carries some of the magical properties once abused by its previous owner.
night-hag	Night Hag	10	Hag Blood	3 gp	1 lb.		vial	3	1	3	 (3 vials)	Absolutely reeking of the foulness that permeated the hag's entire being, drinking this blood has the potential to infect a creature with crone's disease. It should also be noted that while the blood smells and tastes as fetid as it looks, alcohol has a neutralising effect on both of these properties. What someone does with that information is entirely out of this writer's control.
night-hag	Night Hag	15	Night Hag Skull	25 gp	10 lb.	Nightmare Skull		25	10	1		The skull of the night hag continues to carry the same dark energies that it once held in life, corrupting mortals and driving them mad with nightmares.
night-hag	Night Hag	20	Hag Eyeball	50 gp	1 lb.			50	1	1		"Not to be confused with the notorious ""hag eye"" amulet given by hags to their servants, however the two are tightly linked. Despite being severed from its socket, this eye still seems to glare as it did in life. Use: As an action you may concentrate on the hag eyeball while it is in your hand. While doing so, you may utilise that hag's hag eye that same way they would have used it in life. If the hag eye is destroyed while you are concentrating on the hag eyeball, you suffer 3d10 psychic damage and are blinded for 24 hours."
sea-hag	Sea Hag	10	Sea Hag Hair (small pouch)	1 gp	2 lb.	Potion of Water Breathing (DMG)		1	2	1		Resembling rotten seaweed, the hair of a sea hag can be washed, sliced, dried, and then seeped for a prolonged time to create a potion of water breathing. It should be warned however that drinking a potion made from sea hag hair has the potential to infect a victim with crone's disease. 
sea-hag	Sea Hag	10	Hag Blood	3 gp	1 lb.		vial	3	1	3	 (3 vials)	Absolutely reeking of the foulness that permeated the hag's entire being, drinking this blood has the potential to infect a creature with crone's disease. It should also be noted that while the blood smells and tastes as fetid as it looks, alcohol has a neutralising effect on both of these properties. What someone does with that information is entirely out of this writer's control.
sea-hag	Sea Hag	15	Sea Hag Skull	15 gp	10 lb.	Fear Skull		15	10	1		While devoid of its characteristic facial features, the skull of the sea hag still carries a malevolent aura that chills any that gaze upon it.
sea-hag	Sea Hag	20	Hag Eyeball	50 gp	1 lb.			50	1	1		"Not to be confused with the notorious ""hag eye"" amulet given by hags to their servants, however the two are tightly linked. Despite being severed from its socket, this eye still seems to glare as it did in life. Use: As an action you may concentrate on the hag eyeball while it is in your hand. While doing so, you may utilise that hag's hag eye that same way they would have used it in life. If the hag eye is destroyed while you are concentrating on the hag eyeball, you suffer 3d10 psychic damage and are blinded for 24 hours."
half-dragon	Half Dragon	10	Half-Dragon Blood	8 gp	1 lb.		vial	8	1	3	 (3 vials)	While regular dragon blood is too foreign to have any effect on a humanoid without significant alteration, the diluted nature of a half-dragon's blood allows it to bestow significant benefits on a humanoid imbiber. Use: As an action you may drink the vial of half-dragon blood. For the next 10 minutes, you gain the same type of damage resistance of the half-dragon it was taken from.
half-dragon	Half Dragon	15	Half-Dragon Scales (small pouch)	60 gp	10 lb.	Dra-gone Paste/Drag-on Paste		60	10	1		Half-dragons occupy an odd position in the taxonomy of creatures. This is best reflected in the strange effect that their bodies have on the senses of real dragons around them. Their strange physiology seems to cause them to slip beneath the notice of dragons of their own colour, tricking them into thinking they are one of their own. Taking a half-dragon's scales, grinding them into a powder, and then mixing them with oil creates a paste that other humanoids can apply to their own bodies to avoid or promote detection by dragons.
harpy	Harpy	10	Harpy Feather (small pouch)	4 sp	1 lb.			0.4	1	1		Harpy feathers are notably large but of a fine quality, reflective of the harpies beuaitful but dangerous nature. Too large for fletching, they nonetheless make excellent quills.
harpy	Harpy	15	Harpy Vocal Cords	2 gp	2 lb.	Harpy Harp		2	2	1		If harpies are known for one thing, it is their singing. Their vocal cords are able to produce a wide variety of sounds, and some daring bards have taken to using them as strings for their instruments. Bards with instruments of the harpies are said to play music that can entrance entire rooms of listeners.
harpy	Harpy	20	Harpy Egg	8 gp	3 lb.	Harpy Ink		8	3	1		On a rare occasion, you may slay a harpy that was in the middle of ovulation. Whether the egg is fertilised is irrelevant, as it is the eggshell that holds the true value. When this pink-speckled shell is powdered, it makes a dye with potent magical abilities.
hell-hound	Hell Hound	5	Hell Hound Fur (3 tufts)	10 gp	2 lb.			10	2	1		When a hell hound dies, it is consumed by its internal fire leaving nothing behind but ash of burnt fur. While this is disapointing to harvesters, the fur still has some utility. Use: As an action, you may rub 1 tuft of hell hound fur into your hands. If you do so, for the next minute, whenever you roll a 1 or 2 on a fire damage dice roll, you may reroll that die and you must use the new number. After being used, the tuft of hell hound fur loses its magic and becomes useless.
helmed-horror	Helmed Horror	10	Helmed Horror Helmet	15 gp	8 lb.	Blinders Helm		15	8	1		When crafting a helmed horror, no ordinary helmet will do. One made specifically for the purpose must be comissioned in order to grant the unique senses that the helmed horror possesses. With some time, an artificer can take one of these helms and reconfigure the arcane signatures so that they work for regular humanoids.
helmed-horror	Helmed Horror	15	Helmed Horror Essence	60 gp	1 lb.		spirit paper	60	1	1		The animating spirit of a helmed horror dissipates quickly after its form loses structural integrity. If done quickly however, this spirit can be caught using a sheet of spirit paper. No matter how quick you may be however, some of the spirit will have degraded already, thus any attempt at reusing the spirit is sure to result in a lower quality construct than the original helmed horror. Requires spirit paper. Use: You may spend an hour performing a DC 15 Intelligence (Arcana) check with the spirit paper to transfer the essence to an unworn suit of plate armour. If you are successful, the essence leaves the spirit paper and enters the suit of armour, creating an animated armour under your control. This armour follows your instructions to the best of its ability, but lacks the intelligenec to discern any nuance from your words and follows orders to the letter. This animated armour remains until it is destroyed.
hippogriff	Hippogriff	5	Hippogriff Hooves	4 sp	6 lb.			0.4	6	2	 (x2)	The hooves of a hippogriff contain a unique collagen in them that when rendered creates a high quality adhesive. This glue is prized by leatherworkers and most can never find enough to meet their demand.
hippogriff	Hippogriff	10	Hippogriff Feather	1 gp	1 lb.	Arrow, +1 (DMG)		1	1	10	 (x10)	The pristine feathers of a hippogriff carry an almost supernatural aerodynamic quality to them. Fletchers and sharpshooters prize good condition hippogriff feathers for fletching high quality arrows.
hippogriff	Hippogriff	15	Hippogriff Eye	5 gp	1 lb.	Eyes of the Eagle (DMG)		5	1	2	 (x2)	It is said that a hippogriff can spot a mouse in a field from more than 2 miles over. Whether true or not, they can definitely spot an orcish ambush coming from a few hundred feet out, and this is another reason that hippogriffs are so highly valued as mounts and companions.
hobgoblin	Hobgoblin	5	Hobgoblin Ear	2 sp	1 lb.			0.2	1	1		The body of a hobgoblin holds little practical use for harvesters. Most cities however will pay small bounties for hobgoblin ears,
hobgoblin-captain	Hobgoblin Captain	5	Hobgoblin Ear	2 sp	1 lb.			0.2	1	1		The body of a hobgoblin holds little practical use for harvesters. Most cities however will pay small bounties for hobgoblin ears.
hobgoblin-captain	Hobgoblin Captain	10	Hobgoblin War Braid	1 gp	1 lb.			1	1	1		As a hobgoblin grows in experience and prestige, they grow out their hair into braids that are only ever cut if they lose a battle. These braids hold some value to collectors as well as bounty offices as proof of felling a noteworthy hobgoblin threat.
hobgoblin-warlod	Hobgoblin Warlod	5	Hobgoblin Ear	2 sp	1 lb.			0.2	1	1		The body of a hobgoblin holds little practical use for harvesters. Most cities however will pay small bounties for hobgoblin ears.
hobgoblin-warlod	Hobgoblin Warlod	10	Hobgoblin War Braid	1 gp	1 lb.			1	1	1		As a hobgoblin grows in experience and prestige, they grow out their hair into braids that are only ever cut if they lose a battle. These braids hold some value to collectors as well as bounty offices as proof of felling a noteworthy hobgoblin threat.
hobgoblin-warlod	Hobgoblin Warlod	15	Mark of Maglubiyet	5 gp	2 lb.	Amulet of Maglubiyet		5	2	1		When a hobgoblin becomes powerful enough that they are considered a warlord, they receive a special mark to venerate themselves in the face of their deity: Maglubiyet. If skinned correctly and preserved, this mark can be taken by thaumaturges to craft a trinket imbued with the terrifying influence of the goblinoid god.
homunculus	Homunculus	10	Homunculus Material	40 gp	6 lb.			40	6	1		The destroyed body of a homunculus returns to its mundane components upon its death. These components can be recycled into a new homunculus.
homunculus	Homunculus	20	Homunculus Blood	Varies	2 lb.		enchanted vial	Varies	2	1	 (vial)	The homunculus' blood is the same as its master's: a wizard must bleed onto an empty construct in order to bring it to life. While this imparts a connection to that wizard that they would find useful, it can also be exploited by others skilled in the arcane arts who manage to capture said homunculus. As such, the price of this blood can vary wildly depending on which wizard's homunculus it was taken from. Requires enchanted vial. Use: As an action you may drink the homunculus blood. Doing so gives you all the knowledge that the homunculus had up to the point of its death, including the languages it knew, and the knowledge that its creator shared with it. You may not necessarily understand all of this knowledge, especially if it is of a very esoteric nature and you may not necessarily be able to parse all of it. You retain this knowledge for 10 minutes, after which all of it vanishes from your mind. Once this happens, you become stunned for 1 minute as your mind recovers from the influx of information it received.
hooked-horror	Hooked Horror	5	Hooked Horror Exoskeleton	4 gp	40 lb.			4	40	1		The hooked horror's exoskeleton is harder than iron, but unfortunately is difficult to reshape and thus unsuited for armour. However, it does have several other uses including being used as a sturdy container, building material, or even as using its reverberative nature as a percussion instrument. Many Underdark cultures thus value these exoskeletons when recovered in good condition.
hooked-horror	Hooked Horror	10	Hooked Horror Cochlea	10 gp	1 lb.	Shell of Hearing		10	1	1		The extremely sensitive cochlea of a hooked horror is not unlike that of a bat's. Capable of hearing both extreme distances and different wavelengths, this cochlea serves as a key component for various hearing aids and magical items.
hooked-horror	Hooked Horror	15	Hooked Horror Hook	10 gp	5 lb.	War Pick, +1 (DMG)		10	5	2	 (x2)	The eponymous hooks of the hooked horror. Formed of an extremely hard, yet yielding, keratin material. With slight modifications, these hooks can be turned into a formidable war pick that doubles as a climbing pick. 
hydra	Hydra	5	Hydra Scale (large bag)	15 gp	15 lb.			15	15	1		The scales of a hydra have a long history as art materials in coastal societies; hydras are known for shedding many scales throughout their lifetimes. Durable and of a unique hue, they lend an intimidating aesthetic that many tailors would be eager to get their hands on. 
hydra	Hydra	10	Hydra Blood	5 gp	1 lb.	Potion of Superior Healing (DMG)	vial	5	1	7	 (7 vials)	Hydras are well known for their regenerative abilities, a property that has not gone unnoticed by alchemists. In fact hydra blood is one of many potential catalysts when brewing the ubiquitous healing potion. The hydra's powerful blood is known for brewing notably potent mixtures.
hydra	Hydra	15	Hydra Tooth	3 gp	1 lb.	Arrow, +2 (DMG)		3	1	30	 (x30)	Incredibly sharp and incredibly numerous. Coastal societies have been known to craft deadly arrows and spearheads from the many teeth that hydras leave behind as they lose and grow new heads.
hydra	Hydra	15	Hydra Heart Piece	80 gp	10 lb.			80	10	1		An organ capable of scaling up blood circulation regardless of how many heads its body grows, the heart of a hydra is brimming with magical potential. In fact, the heart of a hydra is so powerful that consuming one can even regrow lost limbs. Use: It takes 10 minutes to consume enough hydra heart to have an effect. Once consumed, you regain all hit points as well as regrow any missing body parts. If a body part is regrown in this way, you feel an intense feeling of hunger and suffer 1 level of exhaustion until you consume at least 5 pounds of food. The hydra heart must be consumed within 24 hours upon the death of the hydra, otherwise it gives no effect.
hydra	Hydra	20	Hydra Spinal Cord	350 gp	20 lb.	Staff of Multiplied Recovery		350	20	1		A hydra's spine is a unique piece of biology, capable of adapting itself to more heads than it was originally suited for. Certain vertebrae in particular are noted for holding strong magic, and when used together can make a powerful healing staff.
intellect-devourer	Intellect Devourer	15	Brain Fluid	4 gp	1 lb.		vial	4	1	1	 (vial)	The fluid that oozes through an intellect devourer is not unlike the mucus secreted by their illithid masters. This fluid however has the unique ability to carry and pass on memories to those that consume it. Use: As an action you may drink a vial of brain fluid. If you do so you must make a DC 12 Intelligence saving throw. On a failure, you become stunned for 1 minute as your mind fails to process the information flooding through it. On a success, you learn the identity of who this intellect devourer used to be, as well as one key memory. The key memory is up to the discretion of the DM, but may be something that the intellect devourer knew in its original life, or something it has learned after becoming an intellect devourer.
intellect-devourer	Intellect Devourer	20	Living Brainstem	12 gp	6 lb.			12	6	1		Living is a strong word in this case. Used here, it really means that the brain still has some capacity for interaction and response to stimuli, due largely to the dark rituals used to transform it into an intellect devourer. While it would be much more merciful to put the brain out of its misery by destroying it entirely, it still offers some use for an adventurer with a strong stomach. Use: For 6 hours after an intellect devourer's death, its main brain continues to send weak signals of psionic wavelengths. When the brain is worn directly on top of a humanoid's head, that humanoid becomes immune to the detect sentience ability of intellect devourers. Instead, an intellect devourer that detects that humanoid will assume that humanoid is a host of a living intellect devourer and will treat them accordingly. However, an intellect devourer that can see without using its blindsight will still notice that a humanoid is wearing a brain on the top of their head and will also react accordingly.
invisible-stalker	Invisible Stalker	15	Mote of Air	100 gp	1 lb.	Elemental Gem (Blue Sapphire) (DMG)	enchanted vial	100	1	1		When an air elemental's summoned form is dispersed, it leaves behind small clumps of dust that continue to carry trace amounts of elemental energy. These need to be collected quickly in specialised containers to prevent further degredation. If collected properly, they can then be used to craft an elemental gem. Requires enchanted vial.
invisible-stalker	Invisible Stalker	20	Stalker's Compass	10 gp	1 lb.		enchanted vial	10	1	1		When an invisible stalker is defeated before it can fulfill its mission, a single wisp of a breeze remains that futiley attempts to make its way to its quarry. If this wisp is captured quickly and prevented from further degredation, it will continue indefinitely attempting to reach its quarry. Resourceful trackers mix small amounts of dye into this container to make a makeshift compass that will lead them to whatever the invisible stalker was originally trying to hunt. Requires enchanted vial.
jackalwere	Jackalwere	10	Jackalwere Eye	8 sp	2 lb.			0.8	2	2	 (x2)	The mesmerising eyes of a jackalwere are able to lure unwary travellers into a slumber, and many commonfolk that live in areas frequented by jackalweres make a habit of looking down when speaking to strangers. Use: If you cast the sleep spell you may use a jackalwere eye as a material component. If you do so, you roll an additional 1d8 when determining the amount of hit points affected. You may only use one jackalwere eye at a time, and once used, a jackelware eye loses its magic and becomes useless.
kenku	Kenku	5	Kenku Feather (small pouch)	8 cp	1 lb.			0.08	1	1		Seeing as how kenkus are unable to fly, their feathers are largely vestigial. Still, despite their often dirty nature, they make for good quills. In fact, a good way to spot a kenku forger is to look for one that has bald patches over their body.
