ID	Name	DC	Item	Value	Weight	Crafting	Requires	ValueNumber	WeightNumber	Multiplier	Misc	Description
piercer	Piercer	10	Piercer Shell	2 gp	20 lb.			2	20	1		The slug-like piercer is covered in a rock-like shell that gives it the appearance of a stalactite or stalagmite. This hard shell has been repurposed into many things in Underdark societies including bowls, furniture, and various tools.
pixie	Pixie	15	Pixie Dust (small pouch)	3 gp	1 lb.			3	1	1		The ubiquitous dust dropped by the wings of pixies. Incredibly magical, yet volatile, it is virtually impossible for a non-pixie to determine what will happen when sprinkled on a creature. Use: As an action, you may sprinkle some pixie dust on a creature next to you. If sprinkled on an unwilling creature, they may resist any resulting effect by succeeding on a DC 12 Wisdom saving throw. If sprinkled on a willing creature, or an unwilling creature that failed their saving throw, roll 1d10 and consult the pixie dust effect table for the result. If the result would involve a saving throw, the DC is 12. A small pouch of pixie dust has enough dust in it for 3 uses.
pseudodragon	Pseudodragon	10	Pseudodragon Venom	5 gp	1 lb.		vial	5	1	1	 (vial)	The venom of a pseudodragon has a soporific effect that some alchemists have actually used to create a draught to treat insomnia. Of course, in its pure state, it can still be used as an effective tranquiliser. Use: Can be used to coat 1 piece of slashing or piercing ammunition or one slashing or piercing weapon. Applying the poison takes an action. The next time that the coated ammunition or weapon successfully hits a creature, that creature must succeed on a DC 11 Constitution saving throw or become poisoned for 1 hour. If the saving throw fails by 5 or more, the target falls unconscious for the same duration, or until it takes damage or another creature uses an action to shake it awake.
purple-worm	Purple Worm	5	Purple Worm Blood	130 gp	1 lb.		vial	130	1	9	 (9 vials)	It is a simple fact of Underdark life that you need to have a purple worm ward if you wish to have a long-term settlement. Ironically, these wards require the blood of a purple worm in order to be created. In a way, though it is fitting that only a society that can kill a purple worm can be protected from them. Natural selection at its finest, as it were.
purple-worm	Purple Worm	10	Purple Worm Bile	150 gp	1 lb.		vial	150	1	3	 (3 vials)	The incredibly corrosive bile of a purple worm is coveted by miners for being able to literally eat through rocks that would otherwise take weeks of work to break through. Just be careful when harvesting it, however, you don't want to be known as the fool who was eaten by an already slain purple worm. Use: As an action you may make a ranged weapon attack to throw a vial of purple worm bile at a target within 20 feet, shattering it on impact. Make a ranged attack against the target, treating the vial as an improvised object. On a hit, the target suffers 5d6 acid damage.
purple-worm	Purple Worm	15	Purple Worm Tooth	150 gp	30 lb.	Any melee piercing weapon, +2 (DMG)		150	30	4	 (x4)	Purple worm teeth resemble stalactities and stalagmites in their cavernous mouth more than anything else. Larger than a grown human's arm, these teeth make very good crafting materials and are a rich source of ivory. Alternatively, they can be crafted into fine weapons.
purple-worm	Purple Worm	20	Purple Worm Stinger	2,200 gp	40 lb.	Purple Piercer		2200	40	1		Despite what you may think, it is not much safer to be on the opposite side of a purple worm's mouth, as its tail is perhaps even more deadly. When the stinger head is taken and recrafted into a weapon, it can deliver payloads of venom just as it did when attached to its original owner. 
purple-worm	Purple Worm	25	Purple Worm Pearl	5,000 gp	10 lb.			5000	10	1		With all the dirt and rock that a purple worm chews through, it inevitably swallows some precious gems and metals. These are not digested easily and often clump together in the purple worm's stomach. Melded together by digestive acids and pressure, they form beautiful unique pearls that fetch incredibly high prices on open markets.
quaggoth	Quaggoth	5	Quaggoth Fur (small pouch)	1 gp	4 lb.			1	4	1		Shaggy and coarse, it would not be immediately apparent that quaggoth fur has much use as anything except as a trophy. The fur however has remarkable insulation qualities, and while uncomfortable, can stuff a coat to keep an adventurer warm in even the deepest and darkest Underdark tunnel. 
quaggoth	Quaggoth	10	Quaggoth Blood	1 gp	1 lb.	Potion of Poison Resistance (DMG)	vial	1	1	3	 (3 vials)	Due to their horrible Underdark diets, quaggoths have developed several enzymes and antibodies that make them immune to poisons. If used in an alchemy recipe, it creates a potion of poison resistance. 
quaggoth	Quaggoth	15	Quaggoth Brain (Quaggoth Thonot only)	6 gp	5 lb.			6	5	1		The psionic energy of the Underdark occasionally causes mutations in the susceptible quaggoth population, creating what is known as a thonot. Their brains are noticably larger and capable of psionic feats themselves. When eaten, these psionic abilities are temporarily bequeathed to the eater. Use: You may spend an action to eat this brain. For the next hour, you may cast the feather fall and mage hand spells at will without using a spell slot or requiring any spell components. 
rakshasa	Rakshasa	10	Rakshasa Claw	50 gp	3 lb.	Curse of Nightmares		50	3	2	 (x2)	The hatred and malice inherent in a rakshasa is embodied in their deformed claws, capable of imparting a curse that spites any it strikes. When burned in an occult ritual, the ashes can create a dye used in dark rituals to curse unwary hoarders of magical items.
rakshasa	Rakshasa	15	Rakshasa Heart	450 gp	4 lb.	Amulet of the Trickster		450	4	1		The rakshasa's tendency to kill and subsume the lives of its victims is almost legendary. The heart of the rakshasa drips with this malicious coveting of others' identities, and can be refashioned into an amulet that allows its wielder to do the same.
rakshasa	Rakshasa	20	Rakshasa Hide	1,300 gp	15 lb.	Cloak of Magic Immunity		1300	15	1		While not as potent once removed from its original body, the removed hide of a rakshasa still carries the magical resistance that it is famous for. When reinforced properly, it becomes a fearsome cloak that shrugs off weak spells.
young-remorhaz	Young Remorhaz	10	Remorhaz Blood	2 gp	1 lb.	Potion of Elemental Tempering	vial	2	1	5	 (5 vials)	Anybody who has slain a remorhaz can attest to the virtually boiling blood that spews forth from its open wounds. This blood remains supernaturally warm long after being removed from its body, and arctic cultures use bladders of this as a form of insulation and heating.
young-remorhaz	Young Remorhaz	15	Remorhaz Antenna	25 gp	6 lb.	Security Antenna		25	6	2	 (x2)	The remorhaz has the uncanny ability to sense the movements of creatures around it, based mostly around its incredibly senstive antennae. If taken in whole, they may be re-adapted to be used as a pair of dowsing rods for security purposes.
young-remorhaz	Young Remorhaz	20	Young Remorhaz Carapace	115 gp	65 lb.	Remorhaz Plate		115	65	1		The thick, iron-like scales of even a young remorhaz have incredible insulation properties and can regulate the creature's insect-like body.
remorhaz	Remorhaz	10	Adult Remorhaz Blood	10 gp	1 lb.	Potion of Elemental Tempering	vial	10	1	7	 (7 vials)	Anybody who has slain a remorhaz can attest to the virtually boiling blood that spews forth from its open wounds. This blood remains supernaturally warm long after being removed from its body, and arctic cultures use bladders of this as a form of insulation and heating.
remorhaz	Remorhaz	15	Remorhaz Antenna	25 gp	6 lb.	Security Antenna		25	6	2	 (x2)	The remorhaz has the uncanny ability to sense the movements of creatures around it, based mostly around its incredibly senstive antennae. If taken in whole, they may be re-adapted to be used as a pair of dowsing rods for security purposes.
remorhaz	Remorhaz	20	Adult Remorhaz Carapace	1,000 gp	65 lb.	Remorhaz Plate, +1		1000	65	1		A full grown remorhaz's carapace is twice as thick and durable than in its youth. This carapace when taken and resmelted, becomes an almost impenetrable barrier against both weapons and the elements.
revenant	Revenant	20	Imprint of Vengeance	Varies	1 lb.		spirit paper	Varies	1	1		A revenant's body contains nothing of value that an ordinary corpse would not already possess, and it is usually beyond the abilities of an average harvester to seal away the vengeance fuelled soul of a revenant. However, with quick action and some spirit paper, an imprint of the soul may be saved, allowing one to track the creature that wronged the revenant so badly. Requires spirit paper. Use: While holding this item, you constantly know the distance to and direction of any creature against which the revenant seeks revenge, even if the creature is on a different plane of existence. You become aware if the creature being tracked dies. While holding this paper, the revenant is similarly also aware of your distance and direction to them.
roc	Roc	10	Roc Gizzards	30 gp	30 lb.			30	30	1		Roc is considered quite the delicacy in many mountainous regions. The gizzards of a roc in particular are highly nutritious and fry up wonderfully with onions and root vegetables.
roc	Roc	15	Roc Beak	150 gp	30 lb.	Warhammer, +2 (DMG)		150	30	1		Larger than most humans (as many hapless adventurers find out far too late), this beak is also incredibly strong and capable of smashing steel armour to bits. It is common to find giants using these beaks as various tools, but for a Medium sized creature, it makes for the head of a fine hammer.
roc	Roc	20	Roc's Feather	800 gp	1 lb.			800	1	1		The feather of a roc contains magical properties that make it capable of lifting a creature as large as the roc. It is however difficult to find a sample that retains this property after being removed from the roc's body. Use: While holding this item, you may cast the jump spell on yourself at will. This spell ends if you stop holding the feather.
roc	Roc	25	Roc Heart Piece	2,300 gp	15 lb.	Ring of Storm Giant Growth		2300	15	1		The massive heart of a roc is usually too much for an average adventurer to carry home by themselves. Luckily, the only thing of value is a smaller chamber of the organ about the size of a large basket. This is said to be the place touched by the giant god Annam and is what gives the roc its gargantuan size.
roper	Roper	5	Roper Saliva	5 gp	1 lb.		vial	5	1	1	 (vial)	A piercer continues to produce its horrible musk even as it grows into a full roper, except it now produces it from its stinking maw. It can still be turned into a perfume, even if the thought of doing so is unpleasant.
roper	Roper	10	Roper Shell	10 gp	60 lb.			10	60	1		The even harder and rougher exterior of a fully grown roper has many usages in Underdark culture. It is not uncommon to find many different pieces in an Underdark dwellers home crafted from these shells.
roper	Roper	15	Roper Tendril	10 gp	25 lb.	Debilitating Whip		10	25	6	 (x6)	The trademark tendrils of the roper are still just as useful after removal from their body as before. Due to the roper's endless ability to reproduce these appendages, some Underdark societies actually raise live ropers specifically to take their tentacles as rope and crafting material. The resulting aesthetic of their ropework is disturbing to say the least. If you want to use them for the creation of a whip however, it requires a steady hand in order to not damage the fragile hairs that give it its debiliating qualities. 
rust-monster	Rust Monster	5	Rust Monster Bile	1 gp	1 lb.		vial	1	1	1	 (vial)	Even though a rust monster may be considered a blacksmith's biggest nightmare, their bile is considered a valuable commodity in their line of work. Strong enough to break down rust and metal, careful usage of their bile can be used to restore old weapons to new, and sometimes can be used to craft metal patterns that would be impossible otherwise.
rust-monster	Rust Monster	10	Rust Monster Antenna	1 gp	12 lb.	Metal Detector		1	12	2	 (x2)	Rust monsters have the simultaneously wondrous and aggravating ability to sense any ferrous metal within 30 feet of it. This is a property of their antennae, which can be repurposed into metal detectors for ordinary humanoids (their corrosive abilities being neutralised in the process of course).
rust-monster	Rust Monster	15	Rust Monster Dust (large bag)	3 gp	10 lb.			3	10	1		Taking the carapace of a rust monster and grinding it down into a dust is an all too common tactic for subterranean cultures. This dust continues to carry the corrosive property of the rust monster, and can be used as either a defense neutralising weapon, or as a cruel practical joke. Use: As an action you may toss a handful of rust monster dust at a ferrous non-magical metal item within 5 feet. Upon contact, the dust corrodes and destroys a 1-foot cube of the material. If the item is being worn or carried by a creature, that creature may attempt a DC 11 Dexterity saving throw to avoid this effect. If the object touched is a weapon or armour/shield, it suffers a permanent and cumulative -1 penalty to damage rolls or AC offered respectively. If this penalty reaches -5 for a weapon, drops a piece of armour's offered AC to 10, or drops a shield's AC bonus to 0, then that item is destroyed. A single bag of rust monster dust has enough dust to be used 5 times. 
sahuagin	Sahuagin	5	Sahuagin Blood	5 sp	1 lb.	Potion of the Sahuagin	vial	0.5	1	3	 (3 vials)	Sahuagin are notoriously prone to mutations, manifesting in effects as varied as developing elven characteristics or an extra set of arms. This mutagenic effect works both ways, and their blood is capable of transferring some of a sahuagin's traits to a regular humanoid. It is strongly advised against regular intake of this however, as the full side effects are still unknown.
sahuagin-priestess	Sahuagin Priestess	5	Sahuagin Blood	5 sp	1 lb.	Potion of the Sahuagin	vial	0.5	1	3	 (3 vials)	Sahuagin are notoriously prone to mutations, manifesting in effects as varied as developing elven characteristics or an extra set of arms. This mutagenic effect works both ways, and their blood is capable of transferring some of a sahuagin's traits to a regular humanoid. It is strongly advised against regular intake of this however, as the full side effects are still unknown.
sahuagin-priestess	Sahuagin Priestess	10	Blessing of Sekolah	3 gp	1 lb.			3	1	1		Occasionally, the shark god Sekolah chooses a female sahuagin to be one of their priestesses and imbues them with great divine power. Their spellwork aside, these priestesses can be identified by a marking on the priestesses skin that resembles the bite pattern of a full grown shark. This skin can be used as a short-term charm to copy the shark taming ability of a sahuagin. Use: As an action you may raise this blessing in front of you. Any shark within 120 feet of you that can see you instantly becomes friendly towards you and obeys any command you issue to it, so long as that command does not conflict with that of a real sahuagin. 24 hours after being removed from its original body, this blessing deteriorates and becomes useless.
sahuagin-baron	Sahuagin Baron	5	Sahuagin Blood	5 sp	1 lb.	Potion of the Sahuagin	vial	0.5	1	3	 (3 vials)	Sahuagin are notoriously prone to mutations, manifesting in effects as varied as developing elven characteristics or an extra set of arms. This mutagenic effect works both ways, and their blood is capable of transferring some of a sahuagin's traits to a regular humanoid. It is strongly advised against regular intake of this however, as the full side effects are still unknown.
fire-snake	Fire Snake	5	Salamander Blood	1 gp	1 lb.	Salamander Fire	enchanted vial	1	1	3	 (3 vials)	The blood of a salamander continues to boil with a furious energy long after the salamander's death. Smiths around the world value samples of this blood as a potent fuel source for their forges that allow them to smelt metals that they could not otherwise. Requires enchanted vial.
fire-snake	Fire Snake	10	Fire Snake Scales (small pouch)	3 gp	12 lb.	Warming Waterskin		3	12	1		Salamander scales stay supernaturally warm even after removal from their body. It is not uncommon for wealthy merchants to have winter beds lined with these scales to keep them comfortable in the colder months. Unfortunately, the scales of a young salamander are too soft and small to be used for a set of armour.
salamander	Salamander	5	Salamander Blood	1 gp	1 lb.	Salamander Fire	enchanted vial	1	1	5	 (5 vials)	The blood of a salamander continues to boil with a furious energy long after the salamander's death. Smiths around the world value samples of this blood as a potent fuel source for their forges that allow them to smelt metals that they could not otherwise. Requires enchanted vial.
salamander	Salamander	10	Salamander Fang	20 gp	2 lb.	Fire Dagger		20	2	1		Even though they now have arms to wield weapons, a salamander could very easily still use its formidable bite to kill its foes. Their fangs in particular radiate a deadly heat that can be transferred to a knife when recrafted.
salamander	Salamander	15	Salamander Scale (large pouch)	65 gp	18 lb.	Cinder Shield		65	18	1		Salamander scales stay supernaturally warm even after removal from their body. It is not uncommon for wealthy merchants to have winter beds lined with these scales to keep them comfortable in the colder months. As a fully grown adult, a salamander's scales are more than hard enough to use them for a protective shield.
satyr	Satyr	5	Satyr Hair (small pouch)	1 gp	3 lb.	Hair Tonic		1	3	1		A satyr's covering of thick lustrous fur is as much one of its trademarks as its horns. This hair is so thick in fact, that when brewed into a tonic, it can help regrow the hair of others.
satyr	Satyr	10	Satyr Horn	1 gp	6 lb.			1	6	2	 (x2)	As satyrs are known for inducing feelings of hedonism and excess, it is fitting that certain parts of their body carry the same properties even in death. When ground up and mixed into a paste, satyr horns have been known to carry a strong intoxicating and aphrodisiac effect. This has caused some naive satyrs to become the main event of an unscrupulous lord's party in a way they probably weren't expecting.
scarecrow	Scarecrow	5	Scarecrow Cloth	1 gp	3 lb.			1	3	1		The terrifying visage of the scarecrow, embodied in the sack cloth that constitutes its head. It remains as intimidating as it was when its host was still active, as its empty eyes still seem to see those around it. Use: When worn, you can may target one creature you can see within 30 feet of you as an action. If that target can also see you, it must succeed on a DC 11 Wisdom saving throw or be magically frightened until the end of your next turn. The frightened target is paralyzed. Once this ability has been used, this item loses all magic and becomes worthless.
scarecrow	Scarecrow	10	Evil Spirit	1 gp	1 lb.		spirit paper	1	1	1		The spirit of the evil creature that was used to animate the scarecrow remains around for a few moments even after its host body has been destroyed. With some spirit paper available, this spirit can be harvested and resold to less scrupulous mages. Requires spirit paper.
shadow	Shadow	15	Shadow Wisp	2 gp	1 lb.		spirit paper	2	1	1		Shadows barely have a corporeal form, and any that could be considered such is quickly dispersed once their animating force has been defeated. Some of it can be trapped inside a sheet of spirit paper, however, to be used to vex the unwary. Requires spirit paper. Use: If this item is left in the shadow of an incapacitated creature for at least 10 minutes, that creature's Strength score is reduced by 1d4. The target dies if this reduces its Strength to 0. This effect lasts until the spell lesser restoration or similar magic is used to remove this effect. If a non-evil humanoid dies while suffering from this effect, a new shadow rises from the corpse 1d4 hours later. Once this item has been used once, it loses all magical properties.
shambling-mound	Shambling Mound	10	Shambling Mound Mulch (small pouch x2)	12 gp	5 lb.	Potion of Superior Healing (DMG)		12	5	1		The decaying biomass that would have once fed the shambling mound is forever changed by its exposure to the powerful plant creature. It is a fantastic fertiliser and herbal remedy causing it to be coveted by both gardeners and healers.
shambling-mound	Shambling Mound	15	Shambling Mound Vine	15 gp	11 lb.	Vine Tunic		15	11	4	 (x4)	The lightning that created the shambling mound also causes it to have a resistance to that element. As the shambling mound adds more biomass to its body, it spreads this property to them as well. Intact samples of these can be taken and crafted into a truly unique set of vestments that can boast the same lightning absorbing abilities.
shambling-mound	Shambling Mound	20	Root-stem	110 gp	8 lb.	Wand of the Undergrowth		110	8	1		The root-stem of the shambling mound is actually the entirety of its being in the same way that a humanoid's brain is the entirety of theirs. It is prized in medicine for its regenerative properties and at the same time prized in necromantic schools for its decaying and consuming properties. 
shield-guardian	Shield Guardian	15	Shield Guardian Breastplate	50 gp	15 lb.	Armour of the Guardian		50	15	1		The breastplate of a shield guardian forms the structural basis for the rest of its form. Even if it is removed and refashioned, it can still communicate with the amulet of the original shield guardian, thus making it prime material for certain pieces of equipment.
shield-guardian	Shield Guardian	20	Spell Storing Plate	200 gp	5 lb.	Ring of Spell Storing (DMG)		200	5	1		The same magical framework that allows a shield guardian to store a spell is the same as that used in the famous ring of spell storing. If this plate is harvested properly, it can be refashioned into its much stronger counterpart.
skeleton	Skeleton	5	Bone Dust (small pouch)	8 cp	3 lb.			0.08	3	1		A skeleton touched by foul necromancy is forever changed in ways that transcend the physical. Dust from the bones of a raised skeleton continues to carry foul necromantic energies that can be recycled into other necromantic purposes and rituals. After all, necromancers are not known to waste anything.
minotaur-skeleton	Minotaur Skeleton	5	Bone Dust (small pouch)	8 cp	3 lb.			0.08	3	1		A skeleton touched by foul necromancy is forever changed in ways that transcend the physical. Dust from the bones of a raised skeleton continues to carry foul necromantic energies that can be recycled into other necromantic purposes and rituals. After all, necromancers are not known to waste anything.
minotaur-skeleton	Minotaur Skeleton	15	Minotaur Horn	10 gp	20 lb.	Helm of the Minotaur		10	20	2	 (x2)	The wicked horns of the minotaur have ended more than one hapless adventurer's life. When mounted on a sturdy helm, and with slight magical reinforcement, a wearer can emulate the deadly charge of the horns' original owner.
warhorse-skeleton	Warhorse Skeleton	5	Bone Dust (small pouch)	8 cp	3 lb.			0.08	3	1		A skeleton touched by foul necromancy is forever changed in ways that transcend the physical. Dust from the bones of a raised skeleton continues to carry foul necromantic energies that can be recycled into other necromantic purposes and rituals. After all, necromancers are not known to waste anything.
warhorse-skeleton	Warhorse Skeleton	10	Warhorse Skull	1 gp	30 lb.			1	30	1		A horse touched by necromantic energy is an iconic mainstay of any battle against a necromancer. The skulls of their tainted skeletons still carry some magical energy and can be used to change the appearance of a summoned steed. Use: If you are holding the warhorse skull when you cast either the find steed or find greater steed spells, you may choose to have the resulting summoned mount appear skeletal in nature. This does not affect the summoned mount's abilities or statistics in any way.
slaad-tadpole	Slaad Tadpole	5	Slaad Slime	3 sp	1 lb.		vial	0.3	1	1	 (vial)	The slime that coats a slaad smells like the bottom of a fetid swamp and looks like it too. It is believed that this slime has an innocuation effect against the diseases and parasitic eggs of the slaads, but this is mostly just conjecture. Otherwise, it is a mere curiosity for eccentric researchers.
red-slaad	Red Slaad	5	Slaad Slime	3 sp	1 lb.		vial	0.3	1	1	 (vial)	The slime that coats a slaad smells like the bottom of a fetid swamp and looks like it too. It is believed that this slime has an innocuation effect against the diseases and parasitic eggs of the slaads, but this is mostly just conjecture. Otherwise, it is a mere curiosity for eccentric researchers.
red-slaad	Red Slaad	10	Slaad Heart	30 gp	5 lb.			30	5	1		Slaadi are creatures of pure chaos, born from the unstable energies in Limbo. As such, their very bodies disrupt the natural order of things and those that consume some of their flesh tend to find that probability itself changes for them, if only temporarily. Beware however, as the universe is not to be trifled with, and it tends to find ways to balance itself out later. Use: As an action you may eat this item. If you do so, then once within the next 10 minutes you may choose to bend the laws of fate within your favour. If you do so, you gain advantage on one attack roll, ability check, or saving throw. If you choose not to, this item is wasted. After those 10 minutes have passed, your DM may choose at any time within the next 24 hours to impose disadvantage on 1 attack roll, ability check, or saving throw you make.
