ID	Name	DC	Item	Value	Weight	Crafting	Requires	ValueNumber	WeightNumber	Multiplier	Misc	Description
aarakocra	Aarakocra	5	Aarakocra Feathers (small pouch)	8sp	2 lb.			0.8	2	1		The large feathers of an aarakocra are enjoyed among some of the more ostentatious members of society as fun accessories and fashion highlights. If you can find a tailor willing to take them, you are sure to be able to earn at least a few silver for a good amount of them. 
aarakocra	Aarakocra	10	Aarakocra Heart	2gp	5lb.			2	5	1		Aarakocra have an innate connection to the elemental planes that allows them to summon air elementals when enough of them gather together. Burning their hearts in an offering can achieve much of the same effect but with less control over the temperment of the summoned elemental. Use: When 5 different creatures within 30 feet of each other hold 5 different aarakocra hearts and spend their actions on three consecutive turns to burn the hearts, they may summon an air elemental in an unoccupied space within 60 feet of them. The burners must remain still while burning the hearts. This elemental is hostile to all creatures it can see around it, but any of the 5 creatures that summoned it can spend their action to try and succeed on a DC 15 Charisma (Persuasion) check to direct the air elemental's hostility at a creature they can both see within 60 feet. The air elemental remains for 1 hour.
aboleth	Aboleth	10	Aboleth Teeth (large bag)	20 gp	15 lb.			20	15	1		The razor sharp teeth that line the stinking maw of the aboleth are each as large as a human's forearm and twice as thick. While too unwieldy and crooked to turn into a weapon, more exotic merchants would pay a tidy sum to turn them into decorations and trinkets.
aboleth	Aboleth	15	Aboleth Mucus	20 gp	1 lb.	Potion of Water Breathing (DMG)	vial	20	1	3	 (3 vials)	Aboleths demand service and obsequience, even going so far as to warp the creatures around themselves to suit their domain. While the transformative mucus that surrounds the aboleth tends to dissipate quickly after their death, swift harvesters can bottle some of it for use in alchemy projects later.
aboleth	Aboleth	20	Aboleth Eye	375 gp	45 lb.	Lens of Forgotten History		375	45	1		Larger than a normal creature's head. Removed from its skull and ever unblinking, it still seems to see more than most mortals ever will.
aboleth	Aboleth	25	Aboleth Brain Lobe	1,600 gp	30 lb.	Aboleth Amulet		1600	30	1		The power of the aboleth lies not in its many tentacles, but in its brain. Even now and then, when you hold it long enough, you swear you can hear whispers of forgotten history in the corner of your mind.
deva	Deva	10	Deva Blood	450 gp	1 lb.		vial	450	1	3	 (3 vials)	The blood of an angel flows with radiant energy that brings life to all it touches (it clearly didn't work hard enough for its original owner though). Many of the most desperate people actively seek angels in an attempt to harvest their blood as a panacea, without putting much thought into the worse fate that awaits them should they succeed. Use: When you drink this blood, you regain 4d8+2 hit points and are freed from any curse (except the curse of the fallen), disease, poison, blindness, and deafness.
deva	Deva	15	Deva Wing	700 gp	20 lb.	Wings of Flying (DMG)		700	20	2	 (x2)	There is perhaps nothing more distinctive than the sillhouette of glorious white angel wings against a radiant light. As some of the most powerful magical wings in all the planes, these make for almost perfect base materials for the ever-useful wings of flying.
deva	Deva	20	Deva Skin	750 gp	25 lb.	Angel Robe		750	25	1		The alabaster white skin of a deva gleams in the morning sun, and a single glance of its beatuty has been known to turn sinners from their paths of evil. If you are not one of those people however, you may take this skin and use it to simulate some of the miraculous abilities inherent in these angels.
planetar	Planetar	5	Planetar Ear	200 gp	2 lb.			200	2	2	 (x2)	A planetar is known for its ability to hear lies whenever they are spoken. Their ears carry on this trait even in death and can be seen twitching when falsehood passes through them. Use: While holding two of these ears, you have advantage on Wisdom (Insight) ability checks to detect a lie being spoken.
planetar	Planetar	10	Planetar Blood	600 gp	1 lb.		vial	600	1	3	 (3 vials)	The blood of an angel flows with radiant energy that brings life to all it touches (it clearly didn't work hard enough for its original owner though). Many of the most desperate people actively seek angels in an attempt to harvest their blood as a panacea, without putting much thought into the worse fate that awaits them should they succeed. Use: When you drink this blood, you regain 6d8+3 hit points and are freed from any curse (except the curse of the fallen), disease, poison, blindness, and deafness.
planetar	Planetar	15	Planetar Wing	700 gp	30 lb.	Wings of Flying (DMG)		700	30	2	 (x2)	There is perhaps nothing more distinctive than the sillhouette of glorious white angel wings against a radiant light. As some of the most powerful magical wings in all the planes, these make for almost perfect base materials for the ever-useful wings of flying.
planetar	Planetar	25	Planetar Bone	7,500 gp	6 lb.	Divine Justice		7500	6	1		The celestial bones of a planetar are stronger than steel and carry a charge of radiant energy within them long after their owner's demise. While most radiantly infused weapons are designed to force evil creatures to scurry away, weapons forged from the ever-vigilant planetars are designed to keep evil creatures nearby, ensuring they meet their divine judgement.
solar	Solar	5	Solar Ear	200 gp	2 lb.			200	2	2	 (x2)	A solar is known for its ability to hear lies whenever they are spoken. Their ears carry on this trait even in death and can be seen twitching when falsehood passes through them. Use: While holding 2 of these ears, you have advantage on Wisdom (Insight) ability checks to detect a lie being spoken.
solar	Solar	10	Solar Blood	800 gp	1 lb.		vial	800	1	3	 (3 vials)	The blood of an angel flows with radiant energy that brings life to all it touches (it clearly didn't work hard enough for its original owner though). Many of the most desperate people actively seek angels in an attempt to harvest their blood as a panacea, without putting much thought into the worse fate that awaits them should they succeed. Use: When you drink this blood, you regain 8d8+4 hit points and are freed from any curse (except the curse of the fallen), disease, poison, blindness, and deafness.
solar	Solar	15	Solar Wing	700 gp	30 lb.	Wings of Flying (DMG)		700	30	2	 (x2)	There is perhaps nothing more distinctive than the sillhouette of glorious white angel wings against a radiant light. As some of the most powerful magical wings in all the planes, these make for almost perfect base materials for the ever-useful wings of flying.
solar	Solar	25	Solar Eye	11,000 gp	2 lb.	Celestial Helm		11000	2	2	 (x2)	The burning gaze of a solar is capable of reducing even the strongest of evildoers to a smoking mass of flesh on the ground. Taking these eyes and performing extraordinarily powerful magic on them can transform them into diamonds that shine the same way they did under the solar's control.
animated-armour	Animated Armour	10	Animating Rune	5 sp	1 lb.			0.5	1	1		The basis of any animated object is the magical rune etched into its surface that enchants it and brings it to life. While these runes cannot be transferred from one object to another, resourceful tinkerers are capable of salvaging some of the expensive powders and ashes used to make them, and thus they can be sold for a small bit of profit.
flying-sword	Flying Sword	10	Animating Rune	5 sp	1 lb.			0.5	1	1		The basis of any animated object is the magical rune etched into its surface that enchants it and brings it to life. While these runes cannot be transferred from one object to another, resourceful tinkerers are capable of salvaging some of the expensive powders and ashes used to make them, and thus they can be sold for a small bit of profit.
rug-of-smothering	Rug of Smothering	10	Animating Rune	5 sp	1 lb.			0.5	1	1		The basis of any animated object is the magical rune etched into its surface that enchants it and brings it to life. While these runes cannot be transferred from one object to another, resourceful tinkerers are capable of salvaging some of the expensive powders and ashes used to make them, and thus they can be sold for a small bit of profit.
rug-of-smothering	Rug of Smothering	15	Shimmer Cloth	10 gp	7 lb.	Cloak of Mending (XGE) or Cloak of Billowing (XGE) 		10	7	1		The fibers of an enchanted rug continue to carry on a special property to them even after being rendered inanimate. When looked upon, these fibers seem to glimmer and move ever so slightly without any outside force acting on them. This property has been noted by tailors that incorporate them into various vanity items like the amusing cloak of mending or cloak of billowing.
ankheg	Ankheg	5	Ankheg Chitin	1 gp	30 lb.			1	30	1		Extremely hard, but too unwieldy and unconfortable to use in making armour. The ankheg's hide still finds some uses as a building material, especially for subterranean dwelllers who appreciate its suitability to rocky environments.
ankheg	Ankheg	10	Ankheg Gaster	2 gp	9 lb.	Canteen of Last Resort		2	9	1		A series of bladders in the hindquarters of an ankheg, this organ is analagous to the intestines of a humanoid. Although ankhegs are known for eating flesh, they absorb the majority of their nutrients from the soil they burrow through. Artificers are able to take this fact and create a handy survival tool for explorers with a strong stomach.
ankheg	Ankheg	15	Ankheg Bile	4 gp	1 lb.		vial	4	1	2	 (2 vials)	Ankhegs are well known for their incredibly potent digestive fluids that dissolve their prey. As such, alchemists find ankheg bile to be a particularly useful ingredient when creating their own acidic concoctions. Use: As an action you may make a ranged weapon attack to throw this vial at a target within 20 feet, shattering it on impact. Make a ranged attack against the target, treating the vial as an improvised object. On a hit, the target suffers 1d6 acid damage.
azer	Azer	10	Azer Ash	1 sp	1 lb.			0.1	1	1		Residual material from the azer's corpse. This ash still maintains a faint trace of the magic that created it. While not overly useful, some artisans like to sprinkle it over their creations for good luck.
azer	Azer	15	Azer Bronze Skin	10 gp	50 lb.			10	50	1		Azers need no armour, as their skin is already made of durable, mastercrafted bronze. While the trauma of its owner's demise has made the skin difficult to repurpose directly for armour, it is still high quality material, and any blacksmith worth their salt would be happy to get it.
azer	Azer	20	Spark of Creation	12 gp	1 lb.	Bronze Companion	enchanted vial	12	1	1		Although the azer of this particular flame of creation is dead, a single smouldering spark remains, and those with knowledge of the arcane are able to quickly harvest and store it safely for later use. While small, these sparks have immense potential and are often used in either the construction of living trinkets, or the lighting of magical forges. Requires enchanted vial.
banshee	Banshee	15	Banshee Echo	13 gp	1 lb.		spirit paper	13	1	1		The incorporeal banshee leaves very little behind except the last whispers of its terrible wail. With some spirit paper, a good harvester can collect the echo of this wail before it vanishes forever and use it in times of desperation. Requires spirit paper. Use: You may spend an action to tear this item open and release the banshee wail kept within. All creatures within 30 feet of you that can hear must make a DC 13 Constitution saving throw. On a failure, a creature drops to 0 hit points. On a success, a creature takes 3d6 psychic damage. This wail has no effect on constructs and undead.
banshee	Banshee	20	Banshee Remnant	60 gp	1 lb.	Pipes of Haunting (DMG)	spirit paper	60	1	1		It takes a particularly nimble mind and fast action to trap enough remnants of a banshee to make a usable crafting item. If successful however, they are often refashioned into enchanted reeds that create a haunting noise when used in wind instruments. Requires spirit paper. 
basilisk	Basilisk	5	Basilisk Tooth (small pouch)	2 gp	2 lb.			2	2	1		As the basilisk feeds on stone, its teeth are infamous for being extraordinarily hard and sharp. Stonemasons across the land value these teeth as tools in theit craft.
basilisk	Basilisk	10	Basilisk Eye	2 gp	1 lb.	Basilisk Gaze Poison		2	1	2	 (x2)	The petrifying gaze of the basilisk is known far and wide. As such, the eyes of a basilisk are prized for their inherent magical properties and their use in the creation of petrifying tonics. It is said that more nefarious wizards make use of these eyes to create trapped statues that transform unwary intruders into stone.
basilisk	Basilisk	15	Basilisk Bile	6 gp	1 lb.	Basilisk Gaze Poison	vial	6	1	2	 (2 vials)	It is a common misconception that basilisks digest stone. In fact, the fluids inside the basilisk's gullet transform consumed stone back into organic matter to be consumed. This bile is thus worth a good amount to alchemists seeking to make an oil to counter the effects of a basilisk's gaze.
behir	Behir	10	Behir Scales (large bag)	55 gp	25 lb.			55	25	1		The scales of a behir resemble a dragon's but are different in many ways in the eyes of a trained observer. While these scales are often found decorating items in an unscrupulous tailor's shop marketed as actual dragon scales, the fact that they are much smoother and more flexible than an actual dragon's makes them much more useful for fashion.
behir	Behir	15	Behir Horn	300 gp	30 lb.			300	30	1		The horn of a behir is composed of a unique keratin that has an odd reaction to the presence of dragons. A dragon's mere presence causes these horns to resonate, usually alerting a behir to the presence of their hated foe. The horns will still function in the hands of anyone else, but the dragon usually must be much closer for the vibrations to be detected. Use: When within 1 mile of a dragon (whether it in its true form or polymorphed into a different shape), this horn will begin to vibrate, with the vibrations becoming more pronounced the closer it is to the dragon. This horn does not indicate the direction of the dragon, only its general proximity.
behir	Behir	20	Lightning Sack	875 gp	10 lb.	Lightning Oil or Storm Caller		875	10	1		This large, but surprisingly light leathery sack is located at the back of the behir's cavernous mouth, and is roughly the size of a picnic basket. Inside is a mixture of chemicals, fluids and enzymes that when exposed to the open air, erupts in a destructive crackle of lightning. While extremely dangerous, alchemists and weaponsmiths alike will crawl over themselves to obtain some of this powerful energy. Use: The lightning sack can be thrown by itself up to a range of 20 feet. If thrown, the lightning sack will explode on impact, dealing 4d10 lightning damage to all creatures in a 10 foot radius, or half that on a successful DC 14 Dexterity saving throw.
beholder	Beholder	15	Beholder Membrum	45 gp	40 lb.			45	40	1		The anatomy of a beholder is infinitely alien and strange to any scholar native to the Material Plane. One of the most curious features of the beholder is that aside from its brain, the beholder features a noticeable dearth of internal organs. Instead, any internal space not occupied by brain matter is filled with a large rubbery balloon that seems to act as the beholder's heart, lungs, and stomach. How it achieves all of these simultaneous functions is unknown. This organ is as versatile as its owner, and many scholars are eager to obtain a complete sample for their research into transmutation. 
beholder	Beholder	20	Beholder Eye Stalk	650 gp	9 lb.	Eye Stalk Wand		650	9	1		While the eye stalks of the beholder may be severed from its body, they still retain some of the magical energy that allowed them to fire powerful rays at their enemies. Skilled artificers can take these stalks and use them as the cores of magical wands that emit the same types of rays they emitted in life. Alternatively, four of the intact stalks may be used as part of a ritual to summon a spectator. If a player harvests an eye stalk, roll 1d10. The type of eye stalk they receive corresponds to the number rolled, as described in the beholder statblock.
beholder	Beholder	25	Beholder Main Eye	3,250 gp	30 lb.	Anti-Magic Crystal		3250	30	1		The main eye of the beholder is unique in that instead of issuing forth a beam of magical energy, it instead does the opposite: emitting a cone of nullification that disrupts the Weave and prevents the functioning of any magic it gazes at. While it is inactive due to being severed from a living beholder, learned wizards know how to transfigure this organ into an anti-magic crystal, the type that can be used to protect their own strongholds against magical incursions.
death-tyrant	Death Tyrant	15	Death Tyrant Jaw	700 gp	20 lb.	Greataxe, +2 (DMG)		700	20	1		The teeth of a beholder must never be underestimated, even in death. Their jaws possess a wicked bite, and when attached to the handle of an axe, so can your backswing.
death-tyrant	Death Tyrant	25	Death Tyrant Eye	3,500 gp	20 lb.	Negative Energy Crystal		3500	20	1		The eye of a beholder undergoes a terrible transformation when it transitions into undeath, emitting a cone of negative energy rather than anti-magic. But like a normal beholder eye, this eye can be transformed into a crystal of great power that many powerful wizards enjoy employing in their lairs.
spectator	Spectator	15	Spectator Eye Stalk	14 gp	7 lb.	Lesser Eye Stalk Wand		14	7	1		The stalks of the spectator are less powerful than those of the beholder it consumed to be summoned. However, their potential to be made into wands by artificers are the same. When crafted properly, they continue to contain an arcane charge that allows them to discharge the same types of magical rays they did in life. If a player harvests an eye stalk, roll 1d4. The type of eye stalk they receive corresponds to the number rolled, as described in the spectator statblock.
spectator	Spectator	20	Spectator Main Eye	60 gp	20 lb.	Shield of Reflection		60	20	1		The main eye of the spectator functions differently to that of the beholder. While the beholder's emits an anti-magic cone at all times, the spectator's can be used to reflect poorly casted spells at other targets. When used for crafting, the magic of the eye can be transferred over to a shield, to grant it the same ability.
needle-blight	Needle Blight	5	Needles (small bundle)	5 cp	2 lb.			0.05	2	1		The signature needles of the needle blight. While not more particularly useful than any other needle you would find on the forest floor, some fletchers find they make reliable sturdy material for wooden darts. 
needle-blight	Needle Blight	10	Blight Pollen (small pouch)	3 sp	1 lb.	Potion of Speak With Plants		0.3	1	1		Most blights are incapable of speech as we understand it. Instead, they communicate with each other through the use of pollen that can be carried for miles. Alchemists and druids however have figured out how to repurpose this pollen for potions that allow the user to communicate with regular plant life.
needle-blight	Needle Blight	15	Blight Seeds	1 sp	1 lb.	Blight Oil		0.1	1	5	 (x5)	The rapid ability of the blights to spread their influence is well known to any forest dweller. They do this through the many seeds that each blight carries within them. These dry, wrinkled seeds sprout in a matter of hours and grow to maturity in days, forming the infamous vines, brambles, and weeds of a blight infestation. While most of their dark properties are lost if not planted by an actual blight, some alchemists are capable of repurposing them for a crop fertiliser or an oil that reacts strangely with plantlife.
needle-blight	Needle Blight	20	Gulthias Sap	6 sp	1 lb.		vial	0.6	1	1	 (vial)	The bodies of blights exhibit a strange property. When large quantities are mulched and then strained for some time, a few drops of a sticky, dark red sap sometimes drips out which more daring druids use in their rituals.
twig-blight	Twig Blight	15	Blight Seeds	1 sp	1 lb.	Blight Oil		0.1	1	5	 (x5)	The rapid ability of the blights to spread their influence is well known to any forest dweller. They do this through the many seeds that each blight carries within them. These dry, wrinkled seeds sprout in a matter of hours and grow to maturity in days, forming the infamous vines, brambles, and weeds of a blight infestation. While most of their dark properties are lost if not planted by an actual blight, some alchemists are capable of repurposing them for a crop fertiliser or an oil that reacts strangely with plantlife.
twig-blight	Twig Blight	20	Gulthias Sap	6 sp	1 lb.		vial	0.6	1	1	 (vial)	The bodies of blights exhibit a strange property. When large quantities are mulched and then strained for some time, a few drops of a sticky, dark red sap sometimes drips out which more daring druids use in their rituals.
vine-blight	Vine Blight	5	Vines (small bundle)	5 cp	5 lb.			0.05	5	1		The signature vines of the vine blight. These have been made sturdier yet more flexible in order to constitute the blight's body. When stripped down to their fibers, they make good material for rope and ties.
vine-blight	Vine Blight	10	Blight Pollen (small pouch)	3 sp	1 lb.	Potion of Speak With Plants		0.3	1	1		Unlike the needle blight which uses its pollen to communicate with other needle blights, the vine blight's pollen is capable of interacting directly with other plants, turning entire forests into dark defenders of the blight's domain. Despite that, their usage in alchemy is the same.
vine-blight	Vine Blight	15	Blight Seeds	1 sp	1 lb.	Blight Oil		0.1	1	5	 (x5)	The rapid ability of the blights to spread their influence is well known to any forest dweller. They do this through the many seeds that each blight carries within them. These dry, wrinkled seeds sprout in a matter of hours and grow to maturity in days, forming the infamous vines, brambles, and weeds of a blight infestation. While most of their dark properties are lost if not planted by an actual blight, some alchemists are capable of repurposing them for a crop fertiliser or an oil that reacts strangely with plantlife.
vine-blight	Vine Blight	20	Gulthias Sap	6 sp	1 lb.		vial	0.6	1	1	 (vial)	The bodies of blights exhibit a strange property. When large quantities are mulched and then strained for some time, a few drops of a sticky, dark red sap sometimes drips out which more daring druids use in their rituals.
bugbear	Bugbear	10	Bugbear Hide	8 sp	13 lb.			0.8	13	1		Despite usually being filthy and riddled with mange, an intact bugbear hide can actually serve as very good leather. It is not uncommon for more nomadic people to wear these tanned hides for both comfort and as a sign of their strength.
bugbear-chief	Bugbear Chief	10	Bugbear Hide	8 sp	13 lb.			0.8	13	1		Despite usually being filthy and riddled with mange, an intact bugbear hide can actually serve as very good leather. It is not uncommon for more nomadic people to wear these tanned hides for both comfort and as a sign of their strength.
bugbear-chief	Bugbear Chief	15	Heart of Hruggek	1 gp	6 lb.			1	6	1		The most fearsome of bugbears carry with them the blessing of their god Hruggek which allows them to surge past any danger and debilitations. If you are willing to indulge in your own inner savage, you too can take this blessing by consuming the bugbear's heart, but beware of any side effects. Use: You may spend an action to consume this heart. If you do so, you have advantage on saving throws against being charmed, frightened, paralyzed, poisoned, stunned, or put to sleep for the next hour. Once this effect wears off, you must succeed on a DC 12 Constitution saving throw or gain one level of exhaustion as the adrenalinne filled organ passes through your system.
bulette	Bulette	10	Bulette Teeth (small pouch)	11 gp	2 lb.	Dagger, +1 (DMG) or Spear, +1 (DMG)		11	2	1		Capable of puncturing even steel armour, bulette teeth are well regarded as materials for crafting daggers and spears. Some cultures even consider bulette hunting to be a rite of passage, using the weapon made from their kill for the rest of their adult lives.
bulette	Bulette	15	Bulette Claw	8 gp	10 lb.	Stone Cleaver Weapon		8	10	4	 (x4)	Capable of powerful digging, the bullette claw makes for a wonderful weapon base, one that is capable of piercing rock and metals alike. 
bulette	Bulette	20	Bulette Hide	60 gp	50 lb.	Stone Swim Armour		60	50	1		While the bulette relies on its powerful jaws and claws to tunnel through solid rock, it is aided by a layer of rock dissolving slime that it exudes constantly from its hide. When harvested quickly, the hide itself retains this property and can be crafted into protective equipment for subterranean adventurers.
bullywug	Bullywug	5	Bullywug Tongue	8 cp	3 lb.			0.08	3	1		A bullywug tongue is remarkably long for their size and incredibly tough. Swamp folk can often be found drying these and using them as rope substitutes.
cambion	Cambion	5	Cambion Sulfur (small pouch)	7 gp	2 lb.			7	2	1		Unlike most fiends, a cambion does not dissolve when it is slain. Its bizarre physiology however does still react strangely on death with parts of its body spontaneously combusting as it dies. These reactions are not enough to destroy the body, but it does create small piles of sulfur that are quite useful in various demonology related projects.
